word,meaning,example,translation
worship,礼拝、祈り,Many people gather at the shrine for New Year's worship.,多くの人々が新年の礼拝のためにその神社に集まる。
morality,道徳（性）,The book discusses the complex issue of morality in modern society.,その本は現代社会における道徳という複雑な問題を論じている。
moral,道徳の,It is our moral duty to help people who are in need.,困っている人々を助けることは私たちの道徳的義務である。
sermon,(教会で行われる) 説教,The priest gave a sermon that inspired everyone in the church.,司祭は教会にいる皆を元気づける説教をした。
sin,(宗教上の) 罪、罪悪,"In many religions, telling a lie is considered a sin.",多くの宗教では、嘘をつくことは罪だと考えられている。
sinful,罪深い,He believed that his past actions were sinful and sought forgiveness.,彼は自分の過去の行いが罪深いと信じ、許しを求めた。
archbishop,大司教,The archbishop delivered an important speech on world peace.,大司教は世界平和に関する重要なスピーチを行った。
bishop,司教,The bishop visited the local community to support the poor.,司教は貧しい人々を支援するために地元のコミュニティを訪れた。
priest,(カトリック・英国国教会などの) 司祭,The villagers asked the priest to lead the ceremony.,村人たちは司祭に儀式を執り行ってもらうよう頼んだ。
chapel,礼拝堂,There is a beautiful little chapel on the university campus.,大学のキャンパスには美しく小さな礼拝堂がある。
choir,聖歌隊,The beautiful song sung by the choir moved the audience.,聖歌隊によって歌われたその美しい歌は聴衆を感動させた。
missionary,伝道者、布教者,The missionary spent years helping people in developing countries.,その伝道者は発展途上国の人々を助けるために長年を費やした。
pilgrim,巡礼者、聖地参拝者,Many pilgrims walk a long way to visit the sacred site.,多くの巡礼者がその聖地を訪れるために長い道のりを歩く。
pilgrimage,巡礼,She went on a pilgrimage to visit famous temples in Kyoto.,彼女は京都の有名なお寺を訪れる巡礼の旅に出た。
publication,出版,The publication of his new novel is scheduled for next month.,彼の新しい小説の出版は来月に予定されている。
publish,～を出版する,The young writer hopes to publish her first book soon.,その若い作家は、もうすぐ最初の本を出版したいと望んでいる。
myth,神話,I have always been interested in ancient Greek myths and legends.,私は昔から古代ギリシャの神話や伝説に興味があった。
mythical,神話の,Dragons are mythical creatures that appear in stories around the world.,ドラゴンは世界中の物語に登場する神話上の生き物だ。
proverb,ことわざ、格言,"There is a proverb that says, ""Actions speak louder than words.""",「行動は言葉よりも雄弁である」ということわざがある。
stopover,短期滞在（地）,We had a one-day stopover in Hawaii on our way to Australia.,私たちはオーストラリアへ行く途中、ハワイで1日間の短期滞在をした。
safari,サファリ,"Going on a safari, we saw many wild animals in Africa.",サファリに行って、私たちはアフリカで多くの野生動物を見ました。
atlas,地図帳,This is the atlas which I used for my geography report.,これは私が地理のレポートで使った地図帳です。
aroma,芳香、アロマ,I love the sweet aroma of coffee coming from the kitchen.,キッチンから漂ってくるコーヒーの甘い香りが大好きです。
artistry,芸術的才能,The painter is known for the great artistry shown in his works.,その画家は作品に示される素晴らしい芸術的才能で知られています。
auditorium,観客席,The school auditorium was filled with students for the graduation ceremony.,学校の講堂は卒業式のために生徒でいっぱいでした。
scenery,風景、景色,The scenery from the mountain was so beautiful that I was speechless.,その山からの景色は息をのむほど美しかった。
panorama,全景、パノラマ,The tower offers a stunning 360-degree panorama of the city.,そのタワーからは街の素晴らしい360度のパノラマが見渡せます。
pillar,柱、支柱,The ancient temple is supported by huge stone pillars.,その古代の寺院は巨大な石の柱によって支えられています。
carving,彫刻（作品）,We admired the detailed wooden carving made 100 years ago.,私たちは100年前に作られたその精巧な木彫りに感心しました。
plaster,石こう,"The statue was not stone, but was actually made of plaster.",その像は石ではなく、実は石こうでできていました。
collage,コラージュ,"For art class, I made a collage from old magazine pictures.",美術の授業で、古い雑誌の写真からコラージュを作りました。
masterpiece,傑作、名作,His last novel is considered to be his greatest masterpiece.,彼の最後の小説は、彼の最高の傑作だと考えられています。
patron,後援者、パトロン,"Without his wealthy patron, the artist could not have created such works.",裕福な後援者がいなければ、その芸術家はあのような作品を創作できなかっただろう。
patronage,後援,The museum operates thanks to the patronage of local businesses.,その美術館は地元企業の後援のおかげで運営されています。
graffiti,落書き,The city decided to remove the graffiti from the public walls.,市は公共の壁から落書きを撤去することを決定しました。
recital,リサイタル、独奏［独唱］会,"My friend, who is a talented pianist, will give a recital next month.",才能あるピアニストである私の友人が、来月リサイタルを開きます。
finale,終楽章、フィナーレ,The audience was impressed by the spectacular finale of the show.,観客はそのショーの壮大なフィナーレに感動しました。
rehearsal,リハーサル、下稽古,We need one more rehearsal before the play opens tomorrow.,明日劇が開幕する前に、もう一度リハーサルが必要です。
rehearse,～のリハーサルをする,The actors spent all day rehearsing their lines for the new play.,役者たちは新しい劇のセリフをリハーサルして一日を過ごしました。
debut,（名・動）デビュー、初舞台；デビューする,The young singer made her successful debut with her first album.,その若い歌手は、ファーストアルバムで成功裏にデビューしました。
vandalism,（芸術品などの）破壊、損傷,Vandalism has become a serious problem in this area.,器物破損はこの地域で深刻な問題になっています。
vandalize,～を破壊する,The park benches were vandalized last night by someone.,公園のベンチが昨夜、何者かによって破壊されました。
pageant,（歴史的事件を扱った）野外劇、ページェント,Many local people took part in the historical pageant.,多くの地元の人々がその歴史ページェントに参加しました。
fiction,フィクション,I enjoy reading science fiction more than romance novels.,私は恋愛小説よりもSF（サイエンス・フィクション）を読むのが好きです。
fictitious,架空の、フィクションの,The characters in this story are all completely fictitious.,この物語の登場人物はすべて完全に架空のものです。
parody,パロディー,The movie is a parody of a famous spy film which many people love.,その映画は、多くの人が愛する有名なスパイ映画のパロディーだ。
prologue,プロローグ、序文,The prologue of the novel explains what happened ten years ago.,その小説のプロローグは、10年前に何が起こったかを説明している。
paradox,逆説、パラドックス,It's a paradox that more choices can sometimes make us less happy.,選択肢が増えるとかえって幸福度が下がることがあるというのは、一つの逆説だ。
paradoxical,逆説的な,"He gave a paradoxical answer, which made everyone think deeply.",彼は逆説的な答えをしたが、それが皆を深く考えさせた。
metaphor,隠喩、メタファー,The phrase "time is money" is a common metaphor used in business.,「時は金なり」という言葉は、ビジネスで使われるありふれた隠喩だ。
undergraduate,大学生、学部学生,"As an undergraduate, I spent most of my time studying in the library.",学部学生の頃、私はほとんどの時間を図書館で勉強して過ごした。
doctorate,博士号,She hopes to get a doctorate in chemistry after finishing her master's degree.,彼女は修士課程を終えた後、化学で博士号を取得したいと望んでいる。
dormitory,（大学などの）寮、寄宿舎,The university dormitory is cheaper than renting an apartment alone.,大学の寮は、一人でアパートを借りるよりも安い。
nursery,保育所,Finding a good nursery near the office is difficult for working parents.,職場の近くで良い保育所を見つけることは、働く親にとって難しい。
curriculum,カリキュラム、教育課程,The new school curriculum includes more classes on information technology.,新しい学校のカリキュラムには、情報技術に関する授業がより多く含まれている。
bilingual,２か国語を話す（人）,Being bilingual can be a great advantage when looking for a job.,2か国語を話せることは、仕事を探す際に大きな利点になりうる。
sentence,文,Try to make a sentence using the new vocabulary you learned.,あなたが学んだ新しい語彙を使って、文を作ってみなさい。
phrase,句,I learned a useful phrase that can be used when asking for directions.,道を尋ねるときに使える便利なフレーズを学んだ。
pronunciation,発音,Good pronunciation is as important as knowing many words.,上手な発音は、多くの単語を知っていることと同じくらい重要だ。
pronounce,～を発音する,"If I were a native speaker, I could pronounce this word perfectly.",もし私がネイティブスピーカーなら、この単語を完璧に発音できるのに。
adjective,形容詞,"An adjective is a word that describes a noun, such as ""beautiful.""",形容詞とは、「beautiful」のように、名詞を修飾する単語のことだ。
martial arts,武道、武術,Many people practice martial arts not only for self-defense but also for discipline.,多くの人々が、護身のためだけでなく精神修養のためにも武道を稽古する。
referee,レフェリー、審判員,"The referee blew his whistle, signaling the end of the soccer game.",審判はホイッスルを吹き、サッカーの試合終了を知らせた。
gymnastics,体操,She has been practicing gymnastics since she was five years old.,彼女は5歳の時からずっと体操を練習している。
stamina,スタミナ、持久力,Running every morning is a good way to build up your stamina.,毎朝走ることは、スタミナをつけるための良い方法だ。
