word,meaning,example,translation
resolute,意志の固い、固く決心している,She remained resolute in her decision to study abroad.,彼女は留学するという決心を固く持ち続けた。
dread,～を恐れる、ひどく怖がる,Many students dread taking final examinations.,多くの学生が期末試験を受けるのをひどく恐れている。
fabricate,〈話・情報など〉をでっちあげる、捏造する,The witness was accused of fabricating his testimony.,その目撃者は証言をでっちあげたとして非難された。
compression,圧縮 簡潔化、要約,Data compression is necessary to save storage space.,データの圧縮は保存容量を節約するために必要だ。
hysterical,感情的になった、ヒステリックな,She became hysterical when she heard the shocking news.,その衝撃的な知らせを聞いたとき、彼女はヒステリックになった。
buzz,〈活動・会話などで〉ざわめく,The classroom was buzzing with excitement before the school festival.,教室は学園祭を前に興奮でざわめいていた。
chatter,無駄話、おしゃべり,The endless chatter from the next table was very annoying.,隣のテーブルからの絶え間ないおしゃべりはとても迷惑だった。
dodge,～を〈巧みに〉かわす,He tried to dodge the difficult question asked by the reporter.,彼は記者がした難しい質問をかわそうとした。
tickle,～をくすぐる,The feather tickling my nose made me sneeze.,私の鼻をくすぐる羽のせいでくしゃみが出た。
integral,なくてはならない、不可欠な,Teamwork is integral to achieving our common goal.,チームワークは私たちの共通の目標を達成するために不可欠だ。
adverse,〈天候が〉悪い、〈風向きなどが〉逆の 〈状況が〉不利な,The new policy had an adverse effect on the local economy.,新しい政策は地域経済に悪影響を及ぼした。
dismal,〈場所・時・状況などが〉陰気な、憂うつな,The dismal weather made everyone feel a little depressed.,その陰気な天気のせいで、誰もが少し憂うつな気分になった。
contagious,〈病気が〉伝染性の 〈感情・態度などが〉うつりやすい、すぐに広まる,The doctor warned that this new flu is highly contagious.,医者はこの新しいインフルエンザは非常に伝染性が高いと警告した。
fusion,融合（物）,The restaurant is famous for its fusion of Japanese and French cuisine.,そのレストランは日本料理とフランス料理の融合で有名だ。
exile,追放者、亡命者 〈国外〉追放、亡命,"The writer lived in exile for many years, missing his homeland.",その作家は故郷を思いながら、長年亡命生活を送った。
clerical,事務（員）の,The company needs someone with good clerical skills for the new position.,その会社は新しい役職のために、優れた事務能力を持つ人を必要としている。
nurture,〈子ども・植物など〉を育てる、養育する,It is important to nurture a child's creativity from a young age.,幼い頃から子供の創造性を育むことは重要だ。
finite,有限の、限りのある,We must remember that natural resources on Earth are finite.,地球上の天然資源は有限であることを忘れてはならない。
simultaneous,同時の、同時に起こる,The event featured simultaneous translation in five different languages.,そのイベントでは5つの異なる言語での同時通訳が行われた。
charitable,慈善の 慈悲深い,She made a generous charitable donation to the local hospital.,彼女は地元の病院に多額の慈善寄付をした。
strive,〈懸命に〉努力する,We must all strive to create a more sustainable society.,私たちは皆、より持続可能な社会を創造するために努力しなければならない。
materialistic,物質主義の、実利主義の,Some people argue that modern society has become too materialistic.,現代社会はあまりにも物質主義的になったと主張する人もいる。
humidity,湿気、湿度,The high humidity in summer makes everything feel sticky.,夏の高い湿度はあらゆるものをベタベタに感じさせる。
touchy,神経質な、敏感な,"He is very touchy about his past, so don't mention it.",彼は自分の過去についてとても神経質なので、そのことには触れないでください。
apprentice,見習い、徒弟,The young man worked as an apprentice to a master carpenter.,その若者は大工の棟梁のもとで見習いとして働いた。
eccentric,一風変わった、常軌を逸した,The scientist was known for his eccentric but brilliant ideas.,その科学者は風変わりだが素晴らしいアイデアで知られていた。
reputable,評判のよい、信頼のおける,You should always buy products from a reputable online store.,いつも評判の良いオンラインストアから製品を買うべきだ。
pious,信心深い、敬虔な,My grandmother was a pious woman who went to church every Sunday.,私の祖母は毎週日曜日に教会へ行く信心深い女性だった。
scrub,～をごしごし磨く,I had to scrub the floor hard to remove the stain.,私はそのシミを落とすために床を一生懸命ごしごし磨かなければならなかった。
shatter,〈希望・信念など〉を打ち砕く 〈ガラスなど〉を粉々に割る,The sudden injury shattered his dream of becoming a professional athlete.,突然の怪我は、プロのスポーツ選手になるという彼の夢を打ち砕いた。
detach,～を切り離す、分離する,Please detach the form at the bottom and return it to us.,下部にある用紙を切り離して、私たちに返送してください。
underlying,根底にある、根本的な,We need to find the underlying cause of this serious problem.,私たちはこの深刻な問題の根本的な原因を見つける必要がある。
treacherous,〈安全に見えて〉危険な、油断できない 不誠実な、裏切りの,The mountain path which we climbed was steep and treacherous.,私たちが登った山道は険しく、油断できないものだった。
instill,〈思想など〉を植えつける、教え込む,It is a teacher's job to instill confidence in students.,生徒に自信を植えつけるのが教師の仕事だ。
growl,〈犬などが〉うなる、吠える,The dog started to growl at the stranger approaching the gate.,その犬は門に近づいてくる見知らぬ人にうなり始めた。
entangle,～をもつれさせる、絡ませる,A dolphin was found entangled in a plastic fishing net.,イルカがプラスチックの漁網に絡まっているのが見つかった。
convince,〈人〉を説得する 〈人〉を納得させる,She tried to convince him that her idea was better.,彼女は自分の考えの方が良いと彼を説得しようとした。
habitat,〈動植物の〉生息地、生息場所,Deforestation is destroying the natural habitat of many species.,森林伐採は多くの種の自然生息地を破壊している。
ensure,～を確実にする、保証する ～を確保する,The government took measures to ensure public safety.,政府は公共の安全を確保するための措置を講じた。
adopt,～を採用する、採択する,Our school decided to adopt a new energy-saving policy.,私たちの学校は新しい省エネ方針を採用することを決定した。
emission,排出（量）,The new law aims to reduce greenhouse gas emissions.,新しい法律は温室効果ガスの排出量を削減することを目指している。
ingredient,材料、食材,"This soup is made with fresh, locally grown ingredients.",このスープは新鮮な地元産の食材で作られている。
excessive,過度の、極端な,Excessive use of smartphones may harm your eyesight.,スマートフォンの過度の使用は視力を損なうかもしれない。
drawback,〈状況・考えなどの〉欠点,The main drawback of this plan is its high cost.,この計画の主な欠点は費用が高いことだ。
abandon,～を捨てる、あきらめる,The project was abandoned because it was too expensive.,そのプロジェクトは費用がかかりすぎるため中止された。
drought,干ばつ,The long drought caused a serious water shortage in the area.,長い干ばつがその地域に深刻な水不足を引き起こした。
remote,辺ぴな、人里の 遠い,The scientists traveled to a remote island for their research.,科学者たちは研究のために遠く離れた島へ旅をした。
inquiry,問い合わせ、質問すること,We have received many inquiries about our new product.,私たちの新製品について多くの問い合わせを受けています。
endangered,〈絶滅の〉危機に瀕した,Laws were passed to protect endangered species from poaching.,絶滅危惧種を密猟から守るための法律が可決された。
combat,戦闘,The government announced new policies to combat poverty.,政府は貧困と戦うための新しい政策を発表した。
resistant,耐久性のある 抵抗力のある,This new material is highly resistant to heat and water.,この新素材は熱と水に高い耐久性がある。
conservation,〈動植物・森林などの〉保護、保存,He is actively involved in wildlife conservation activities.,彼は野生生物の保護活動に積極的に関わっている。
infectious,〈感情などが〉うつりやすい、すぐに広がる 〈病気が〉伝染性の、〈空気〉感染する,Her cheerful laugh was so infectious that we all started laughing.,彼女の陽気な笑いはとてもうつりやすく、私たちは皆笑い始めた。
controversial,論争を引き起こす 論争好きな,The use of AI in art remains a controversial topic.,芸術におけるAIの使用は、依然として議論を呼ぶ話題だ。
resort,〈手段に〉頼る、訴える,"Having no other choice, he had to resort to borrowing money.",他に選択肢がなく、彼はお金を借りるという手段に頼らざるを得なかった。
transform,～を変える,The internet has completely transformed the way we communicate.,インターネットは私たちのコミュニケーション方法を完全に変えた。
brochure,パンフレット、小冊子,You can find more details in the brochure I gave you.,あなたに渡したパンフレットでより詳しいことがわかります。
subscription,〈予約〉購読,I canceled the magazine subscription which I no longer read.,私はもう読まなくなった雑誌の定期購読を解約した。
hazardous,有害な、危険な,We must reduce hazardous chemicals released into the atmosphere.,私たちは大気中に放出される有害な化学物質を削減しなければならない。
inaccurate,不正確な、誤った,"If the weather forecast were inaccurate, our plan would be ruined.",もし天気予報が不正確だったら、私たちの計画は台無しになるだろう。
hostile,〈環境などが〉厳しい 敵意を持った,The desert is a hostile environment where few animals can survive.,砂漠は、ごくわずかな動物しか生き残れない厳しい環境である。
