word,meaning,example,translation
cozy,居心地のよい,"The small café, which has a fireplace, is very cozy in winter.",暖炉のあるその小さなカフェは、冬はとても居心地が良い。
brutal,残酷な、残忍な,The winter was so brutal that many animals could not survive.,その冬は非常に厳しく、多くの動物が生き残れなかった。
inventive,創意に富む,The engineer who created this device is known for his inventive ideas.,この装置を開発した技術者は、その創意に富んだアイデアで知られている。
sober,酔っていない、しらふの,You must be completely sober if you are going to drive a car.,車を運転するつもりなら、完全なしらふでなければならない。
privilege,特権、特典,It is a great privilege to study at such a famous university.,このような有名な大学で学べるのは、大変な特権です。
trespass,不法侵入する,"Seeing the sign, he knew he should not trespass on private property.",標識を見て、彼は私有地に不法侵入すべきではないとわかった。
procession,行列,We watched the festival procession moving slowly through the crowded street.,私たちは祭りの行列が混雑した通りをゆっくりと進んでいくのを見た。
vain,うぬぼれた、自信過剰な,It was vain of him to think everyone admired his new hairstyle.,誰もが彼の新しい髪型を褒めていると思ったとは、彼はうぬぼれていた。
confer,～を与える、授与する,The university will confer an honorary degree upon the famous scientist.,その大学は、その有名な科学者に名誉学位を授与する予定だ。
deceive,〈人〉をだます、欺く,He tried to deceive the teacher by submitting his friend's report.,彼は友人のレポートを提出して先生をだまそうとした。
allegation,〈根拠のない〉申し立て,The politician denied the allegation that he had accepted a bribe.,その政治家は、賄賂を受け取ったという申し立てを否定した。
affiliate,～を提携させる,Our company is affiliated with a large corporation in the United States.,私たちの会社は、米国の大きな企業と提携しています。
prolong,～を引き延ばす、長引かせる,This new medicine is expected to prolong the lives of many patients.,この新薬は多くの患者の命を長引かせることが期待されている。
overhaul,分解修理、オーバーホール,The old engine needs a complete overhaul before it can be used again.,その古いエンジンは、再び使えるようにする前に完全な分解修理が必要だ。
deduct,～を差し引く、控除する,Taxes will be deducted from your salary before you receive it.,税金は、あなたが給料を受け取る前に差し引かれます。
feasible,〈計画・方法などが〉実現可能な,We need to find a more feasible plan to solve this problem.,この問題を解決するためには、より実現可能な計画を見つける必要がある。
mercy,慈悲、情け,The defeated soldiers begged for mercy from their conquerors.,敗れた兵士たちは、征服者たちに慈悲を乞うた。
oppress,〈人・集団〉を虐げる、圧迫する,The people were oppressed by a cruel dictator for many years.,人々は長年にわたり、残酷な独裁者によって虐げられていた。
entrust,～に委ねる、任せる,I will entrust you with this important task while I am away.,私が留守の間、この重要な仕事を君に任せます。
sturdy,頑丈な、丈夫な,This table is sturdy enough to support a lot of heavy books.,このテーブルは、たくさんの重い本を支えるのに十分頑丈だ。
cynical,懐疑的な,He has become cynical about politics after seeing so much corruption.,彼は多くの腐敗を見てきた後、政治に対して懐疑的になった。
conspire,共謀する、企む,The group was arrested for conspiring to overthrow the government.,そのグループは政府転覆を共謀したかどで逮捕された。
exert,〈自分〉を奮闘させる 〈力など〉を使う、行使する,We must exert more pressure on the government to change the law.,法律を変えるために、私たちは政府にもっと圧力をかける必要がある。
grumble,不平を言う、ぶつぶつ言う,He is always grumbling about the amount of homework he has.,彼はいつも自分の宿題の量について不平を言っている。
prosecute,～を起訴する,The company was prosecuted for illegally dumping chemical waste.,その会社は化学廃棄物を不法に投棄したことで起訴された。
delegate,～を任せる、委託する,The manager decided to delegate some tasks to her assistant.,マネージャーは部下にいくつかの仕事を任せることに決めた。
tremble,〈人・声などが〉震える,His hands began to tremble with fear before the speech.,スピーチの前、彼の両手は恐怖で震え始めた。
earnest,熱心な、真剣な,She made an earnest effort to pass the final examination.,彼女は期末試験に合格するために真剣な努力をした。
generate,～を生み出す、発生させる,This new system is expected to generate a lot of electricity.,この新しいシステムは多くの電力を生み出すと期待されている。
threaten,～を脅す、脅迫する ～の脅威になる,Pollution threatens the lives of many wild animals living here.,汚染はここに住む多くの野生動物の命を脅かしている。
boost,励まし、元気づけ 上昇、増加,The government's new policy helped to boost the economy.,政府の新政策は経済を押し上げるのに役立った。
donate,～を寄付する 〈臓器など〉を提供する,He decided to donate his old books to the local library.,彼は古い本を地元の図書館に寄付することに決めた。
evolve,進化する,Humans have evolved to adapt to various environments.,人類は様々な環境に適応するために進化してきた。
interact,交流する 相互に作用する,Students should interact with people from different cultural backgrounds.,学生は異なる文化背景を持つ人々と交流すべきだ。
predator,捕食動物、捕食者,The lion is a powerful predator at the top of the food chain.,ライオンは食物連鎖の頂点にいる強力な捕食動物だ。
capacity,能力 収容能力、容量,She has a great capacity to understand complex scientific theories.,彼女には複雑な科学理論を理解する素晴らしい能力がある。
mainstream,主流の、普通の,Organic food is now becoming more mainstream in many countries.,有機食品は今や多くの国でより主流になってきている。
accommodate,～を収容できる ～に配慮する、～のために便宜を図る,The new hotel can accommodate up to 500 guests at a time.,その新しいホテルは一度に500人までの客を収容できる。
expertise,専門知識,We need someone with expertise in computer programming for this job.,この仕事にはコンピュータープログラミングの専門知識を持つ人が必要だ。
graze,草をはむ,We saw several cows grazing peacefully in the green field.,私たちは数頭の牛が緑の野原で穏やかに草をはんでいるのを見た。
erupt,〈感情を〉爆発させる 噴火する 〈暴動などが〉勃発する,"The volcano, which had been quiet for years, suddenly erupted.",何年も静かだったその火山が、突然噴火した。
withstand,～に耐える、持ちこたえる,This building was designed to withstand strong earthquakes and winds.,この建物は強い地震や風に耐えられるように設計された。
fascination,魅了されること,He has a deep fascination for ancient Roman history.,彼は古代ローマ史に深い魅力を感じている。
classify,～を分類する,Scientists classify living things into several different groups.,科学者は生物をいくつかの異なるグループに分類する。
alternate,揺れ動く、交替で行われる,My feelings alternate between hope and anxiety about the result.,私の気持ちはその結果について希望と不安の間で揺れ動く。
fundamental,基本的な、根本的な,Respect for others is a fundamental principle of our society.,他者への敬意は私たちの社会の基本原則である。
venue,開催地、会場,The city library was chosen as the venue for the event.,市立図書館がそのイベントの会場として選ばれた。
optional,任意の、選択が自由の,The guided tour of the museum is optional for all students.,博物館のガイド付きツアーは全生徒にとって任意参加です。
validity,妥当性、正当性 〈法的な〉効力、有効性,Some experts are questioning the validity of the research results.,何人かの専門家がその研究結果の妥当性に疑問を呈している。
leak,〈情報〉を漏えいする 〈液体・容器が〉漏れる,It is important that this secret information does not leak.,この秘密情報が漏れないことが重要だ。
considerate,思いやりのある,It was considerate of him to offer his seat to the elderly person.,お年寄りに席を譲るなんて、彼は思いやりがあった。
outweigh,～より重要である、～に勝る,The benefits of this new policy clearly outweigh the potential risks.,この新政策の利点は、潜在的なリスクを明らかに上回る。
wholesale,卸しの、卸売りの 大規模な、大量の,The store buys fresh vegetables at wholesale prices from local farmers.,その店は地元の農家から卸値で新鮮な野菜を仕入れている。
withdraw,引き下がる；〈競技などへの〉出場を取り消す 〈預金〉を引き出す 〈前言〉を撤回する,I need to withdraw some money from the ATM before I go shopping.,買い物に行く前に、ATMからお金をいくらか引き出す必要がある。
dock,埠頭、波止場,We watched the large ferry slowly approach the dock.,私たちは大きなフェリーがゆっくりと埠頭に近づくのを見ていた。
deceased,死去した,The deceased artist's paintings are now worth a fortune.,亡くなったその芸術家の絵画は、今では大変な価値がある。
recruitment,〈社員などの〉新規採用；人員補充,The company has a new online system for the recruitment of employees.,その会社は従業員採用のための新しいオンラインシステムを導入した。
adaptation,改作、脚色〈作品〉,This film is a modern adaptation of a classic novel.,この映画は古典小説を現代風に脚色したものである。
prime,最高の、最上の 主要な,Finding a solution to this problem is our prime objective.,この問題の解決策を見つけることが、我々の主要な目標だ。
faculty,〈大学の〉学部；教職員,The university's faculty includes many world-renowned scholars.,その大学の教職員には、世界的に有名な学者が多く含まれている。
objective,目的、目標,The main objective of this research is to improve people's health.,この研究の主な目的は人々の健康を増進することだ。
artifact,人工遺物 工芸品,Ancient artifacts discovered in the tomb are displayed in the museum.,その墓で発見された古代の工芸品が博物館に展示されている。
verbal,口頭の,"We made a verbal agreement, which we will confirm in writing later.",私たちは口頭で合意し、後で書面で確認することになるだろう。
endeavor,懸命に努力する,Scientists will endeavor to find a cure for the rare disease.,科学者たちはその珍しい病気の治療法を見つけようと懸命に努力するだろう。
devoted,献身的な、熱心な,She is a devoted researcher who spends most of her time in the lab.,彼女はほとんどの時間を研究室で過ごす、献身的な研究者だ。
diploma,卒業証書、学位,"Having received his diploma, he began searching for a job abroad.",卒業証書を受け取ると、彼は海外での仕事を探し始めた。
dictate,～を命令する、指図する ～を書き取らせる,Tradition often dictates how people should behave at ceremonies.,伝統が、儀式で人々がどう振る舞うべきかを指図することがよくある。
compensate,～に補償する、埋め合わせをする,The airline will compensate passengers for the long delay.,航空会社は長時間の遅延に対して乗客に補償するだろう。
urgency,緊急、切迫,There is a great sense of urgency to solve this environmental problem.,この環境問題を解決するには、大変な緊急性がある。
sneak,こっそり歩く ～をこっそり持ち出す、持ち込む,He tried to sneak into the kitchen for a late-night snack.,彼は夜食を求めて、こっそり台所に入ろうとした。
heap,〈雑然と積み上げた〉山、堆積,I found my lost keys under a heap of old newspapers.,私は古い新聞の山の下で、なくした鍵を見つけた。
ethical,倫理的な、道徳的な,Is it ethical to use animals for scientific experiments?,科学実験に動物を使うことは倫理的だろうか。
consensus,〈意見などの〉一致、合意,The group was unable to reach a consensus on the important issue.,そのグループは、その重要問題について合意に達することができなかった。
sentimental,感情的な、感傷的な,This old photograph has a great sentimental value for me.,この古い写真は私にとって、とても大きな感傷的な価値がある。
apparent,明白な、明瞭な,It was apparent from his expression that he was disappointed.,彼ががっかりしていることは、その表情から明らかだった。
subsidize,～に補助金［助成金］を与える,The government will subsidize farmers growing organic vegetables.,政府は有機野菜を栽培する農家に補助金を出すだろう。
captive,捕らえられた,The captive animals were finally released back into the wild.,捕らえられていた動物たちは、ついに野生に返された。
applaud,～を称賛する 拍手する,The audience applauded the pianist's amazing performance.,聴衆はピアニストの素晴らしい演奏に拍手を送った。
forthcoming,率直な、協力的な 来たるべき、今度の,Details of the forthcoming event will be announced next week.,来たるイベントの詳細は来週発表されます。
trigger,～の引き金になる、～を誘発する,The sudden announcement triggered confusion among the students.,その突然の発表は学生たちの間に混乱を引き起こした。
deficit,不足〈額〉、赤字,The country is trying to reduce its huge budget deficit.,その国は巨額の財政赤字を削減しようと努めている。
stain,しみ、汚れ,I can't remove this coffee stain from my favorite shirt.,私のお気に入りのシャツからこのコーヒーのしみが取れない。
oversight,ミス、見落とし 監視、監督,The error in the report was a simple oversight by the team.,報告書の誤りは、チームによる単純な見落としだった。
defendant,被告,The defendant claimed he was innocent throughout the trial.,被告は裁判を通して無実であると主張した。
fragment,破片、断片,She found a small fragment of ancient pottery in the garden.,彼女は庭で古代の陶器の小さな破片を見つけた。
disastrous,破滅を招く、悲惨な,The oil spill had a disastrous effect on marine life.,石油流出は海洋生物に壊滅的な影響を与えた。
invoice,送り状、請求明細書,Please pay the amount shown on the invoice by the end of the month.,請求書に記載の金額を月末までにお支払いください。
elevate,～を上げる、持ち上げる,Good music can elevate your mood when you feel down.,良い音楽は、気分が落ち込んでいるときに気分を高めてくれる。
irrigate,〈作物〉に水をやる；〈土地〉を灌漑する,Farmers use canals to irrigate their fields during dry seasons.,農家は乾季に畑を灌漑するため用水路を使う。
nuisance,迷惑な人［もの］、厄介なこと,The constant noise from the construction site is a public nuisance.,工事現場からの絶え間ない騒音は公共の迷惑だ。
dejected,意気消沈した、落胆した,He looked dejected after hearing the disappointing news.,そのがっかりさせる知らせを聞いて、彼は落胆しているように見えた。
consecutive,連続した,The team won the championship for three consecutive years.,そのチームは3年連続で選手権に優勝した。
wretched,悲惨な、みじめな,The refugees were living in wretched conditions with little food.,難民たちは、食料もほとんどない悲惨な状況で暮らしていた。
distort,～をゆがめる,Some media outlets distort the facts to attract more readers.,一部のメディアは、より多くの読者を引きつけるために事実を歪めている。
verify,～を確認する、証明する,You need to verify your email address to complete registration.,登録を完了するには、メールアドレスを確認する必要があります。
punctuality,時間厳守,Punctuality is considered a very important virtue in Japanese society.,時間厳守は日本社会において非常に重要な美徳だと考えられている。
courtesy,礼儀正しさ、丁重さ 厚意,He treated all the guests with great courtesy and respect.,彼はすべての客に対して、非常に礼儀正しく敬意をもって接した。
foe,敵、〈競技などの〉相手,The two former rivals became friends after facing a common foe.,かつての二人のライバルは、共通の敵に直面した後、友人になった。
crooked,曲がっている,We walked along a crooked path leading to the old temple.,私たちは古い寺へと続く曲がりくねった道を歩いた。
famine,飢饉,The long drought resulted in a terrible famine across the region.,長い干ばつは、その地域一帯にひどい飢饉をもたらした。
waver,動揺する、迷う,His confidence began to waver when he faced the difficult choice.,難しい選択に直面したとき、彼の自信は揺らぎ始めた。
indebted,恩義がある、借りがある,I am deeply indebted to you for your generous support.,あなたの寛大な支援に深く感謝しています。
indifferent,無関心な 重要でない,He seems indifferent to the environmental problems we are facing.,彼は私たちが直面している環境問題に無関心なようだ。
gracious,親切な、腰の低い,The host was gracious enough to show us around the house.,主人は親切にも家の中を案内してくれた。
unwarranted,根拠のない、不当な,Her criticism of the new policy was completely unwarranted.,その新しい方針に対する彼女の批判は全く根拠のないものだった。
refrain,控える,Please refrain from using mobile phones during the performance.,上演中は携帯電話のご使用をお控えください。
foresight,先見（の明）,She had the foresight to invest in renewable energy early on.,彼女には早くから再生可能エネルギーに投資する先見の明があった。
consolidate,～を強固にする 〈複数の会社・組織など〉を統合する,The company plans to consolidate its position in the Asian market.,その会社はアジア市場での地位を強固にする計画だ。
botanical,植物の、植物性の,We visited a botanical garden which has many rare plants.,私たちは多くの珍しい植物がある植物園を訪れた。
axis,軸,The Earth rotates on its axis once every 24 hours.,地球は24時間ごとに地軸を中心に1回転する。
inscription,碑文、銘,The ancient inscription on the stone was difficult to read.,その石に刻まれた古代の碑文は読むのが難しかった。
minute,微小な、微細な,Even a minute amount of the chemical can cause a reaction.,ごく微量の化学物質でさえ、反応を引き起こすことがある。
archive,文書保管所,The historical documents are carefully preserved in the national archive.,その歴史的文書は国立公文書館で注意深く保存されている。
ascent,登ること、上昇,The climbers began their final ascent of the mountain at dawn.,登山家たちは夜明けにその山の最後の登頂を開始した。
abruptly,突然、不意に,"The train, which had been running smoothly, stopped abruptly.",順調に走っていた電車が、突然止まった。
proficient,熟達した、技量のある,"To get the job, you must be proficient in English.",その仕事を得るには、英語に堪能でなければならない。
dispense,～を調剤する、調合する ～を分配する,The machine dispenses tickets to people waiting in line.,その機械は列で待っている人々にチケットを分配する。
eloquent,雄弁な、聴衆の心に訴える,He delivered an eloquent speech that moved the entire audience.,彼は聴衆全員を感動させる雄弁なスピーチを行った。
vandalize,〈芸術作品など〉を〈故意に〉破壊する,The statue in the park was vandalized by someone last night.,公園の像が昨夜、何者かによって破壊された。
mediocre,よくも悪くもない、平凡な,"Despite his efforts, his performance was considered mediocre by the judges.",彼の努力にもかかわらず、その演技は審査員に平凡だと見なされた。
outgoing,社交的な、外交的な 〈間もなく〉退職する、引退する,My sister is much more outgoing than I am.,私の姉は私よりもずっと社交的だ。
plunge,突っ込む、飛び込む 〈価値などが〉急落する,The company's stock price plunged after the news was announced.,そのニュースが発表された後、その会社の株価は急落した。
stern,厳格な、厳しい,The teacher gave the noisy students a stern look.,先生は騒がしい生徒たちを厳しい顔つきで見た。
insistent,しつこい、執拗な,He was insistent that we should follow the original plan.,彼は私たちが当初の計画に従うべきだと強く主張した。
frailty,弱さ、虚弱,The story reminds us of the frailty of human life.,その物語は私たちに人生の儚さを思い起こさせる。
outsmart,〈知恵・策略を使って〉～の裏をかく,The new AI program can outsmart even the best chess players.,新しいAIプログラムは最高のチェスプレイヤーさえも裏をかくことができる。
casualty,被害者、犠牲者 〈事故・戦闘などの〉死傷者,"Fortunately, there were no casualties in the train accident.",幸いにも、その列車事故での死傷者はいなかった。
narrative,物語、語り口,The museum presents a new narrative of the city's history.,その博物館は市の歴史に関する新しい物語を提示している。
bewilder,～を困惑させる、当惑させる,I was bewildered by the professor's complicated explanation.,私は教授の複雑な説明に困惑した。
void,〈契約などが〉無効の からの、空虚な,The contract was declared void because it was not signed.,その契約は署名がなかったため無効と宣言された。
hinder,〈発展・動きなど〉を妨げる、妨害する,Bad weather will hinder the rescue team's efforts.,悪天候は救助隊の努力を妨げるだろう。
perpetual,ひっきりなしの、絶え間ない 永続的な、不変の,Residents complained about the perpetual noise from the construction site.,住民たちは工事現場からの絶え間ない騒音に不満を言った。
phobia,病的恐怖,"He has a phobia of flying, so he always travels by train.",彼は飛行機恐怖症なので、いつも電車で移動する。
sibling,兄弟姉妹（の1人）,Getting along with a younger sibling can sometimes be difficult.,年下の兄弟姉妹と仲良くするのは時に難しいことがある。
orphan,〈子ども〉を孤児にする,The war orphaned many children who lost their parents.,その戦争は両親を失った多くの子供たちを孤児にした。
elaborate,凝った、入念な 込み入った,She wore an elaborate dress which was decorated with beautiful beads.,彼女は美しいビーズで飾られた凝ったドレスを着ていた。
autograph,〈著名人の〉サイン,I was too shy to ask the famous actor for his autograph.,私は有名俳優にサインを求めるには内気すぎた。
envelop,～を包む、覆う,A thick fog began to envelop the entire town.,濃い霧が町全体を包み始めた。
prevail,〈戦い・論争で〉勝つ 広く行きわたっている,We believe that justice will prevail in the end.,私たちは最終的に正義が勝つと信じている。
gratuity,心づけ、チップ,"In this restaurant, a 15% gratuity is automatically added to the bill.",このレストランでは、15%の心づけが自動的に勘定に加えられます。
startle,～をびっくりさせる,I was startled by the sudden noise from the kitchen.,私は台所からの突然の物音にびっくりした。
outcast,〈社会から〉追放された人、のけ者,He felt like an outcast because he had different opinions.,彼は違う意見を持っていたので、のけ者のように感じた。
stagger,よろめく、ふらつく,The injured player managed to stagger off the field.,負傷した選手はなんとかよろめきながらフィールドを離れた。
